{
  "$schema": "https://json-schema.org/draft/2020-12/schema",
  "$id": "https://pcs.sentinelops.ci/schemas/EvidenceBundle.v0.schema.json",
  "title": "EvidenceBundle.v0",
  "type": "object",
  "required": [
    "bundle_id",
    "schema_version",
    "claim_refs",
    "assumption_set_refs",
    "runtime_receipt_refs",
    "certificate_refs",
    "artifact_hashes",
    "created_at",
    "producer",
    "producer_version",
    "source_repo",
    "source_commit",
    "signature_or_digest"
  ],
  "additionalProperties": false,
  "properties": {
    "bundle_id": { "type": "string", "minLength": 1 },
    "schema_version": { "$ref": "common.defs.json#/$defs/schema_version" },
    "claim_refs": { "$ref": "common.defs.json#/$defs/ref_list" },
    "assumption_set_refs": { "$ref": "common.defs.json#/$defs/ref_list" },
    "runtime_receipt_refs": { "$ref": "common.defs.json#/$defs/ref_list" },
    "certificate_refs": { "$ref": "common.defs.json#/$defs/ref_list" },
    "artifact_hashes": { "$ref": "common.defs.json#/$defs/hash_map" },
    "created_at": { "$ref": "common.defs.json#/$defs/iso8601_datetime" },
    "producer": { "type": "string", "minLength": 1 },
    "producer_version": { "type": "string", "minLength": 1 },
    "source_repo": { "type": "string", "format": "uri" },
    "source_commit": { "type": "string", "minLength": 7 },
    "signature_or_digest": { "$ref": "common.defs.json#/$defs/hex_digest" }
  }
}
