{
  "bundle_id": "evidence-qc-release-v0.1",
  "schema_version": "v0",
  "claim_refs": ["claim-qc-release-v0.1"],
  "assumption_set_refs": ["as-labtrust-qc-v0.1"],
  "runtime_receipt_refs": ["receipt-qc-release-run-001"],
  "certificate_refs": ["cert-trace-qc-release-v0.1"],
  "artifact_hashes": {
    "claim-qc-release-v0.1": "sha256:2222222222222222222222222222222222222222222222222222222222222222",
    "receipt-qc-release-run-001": "sha256:7777777777777777777777777777777777777777777777777777777777777777",
    "cert-trace-qc-release-v0.1": "sha256:8888888888888888888888888888888888888888888888888888888888888888"
  },
  "created_at": "2026-05-16T12:12:00Z",
  "producer": "labtrust-gym",
  "producer_version": "0.1.0",
  "source_repo": "https://github.com/fraware/LabTrust-Gym",
  "source_commit": "aaaaaaaaaaaaaaaaaaaaaaaaaaaaaaaaaaaaaaaa",
  "signature_or_digest": "sha256:9999999999999999999999999999999999999999999999999999999999999999"
}
